{
  "record_date": "2026-04-30",
  "tot_pub_debt_out_amt": "38967833861543.11",
  "debt_held_public_amt": "31272489865435.88",
  "intragov_hold_amt": "7695343996107.23",
  "src_line_nbr": "1",
  "record_fiscal_year": "2026",
  "record_fiscal_quarter": "Q2",
  "record_calendar_year": "2026",
  "record_calendar_quarter": "Q2",
  "record_calendar_month": "04",
  "record_calendar_day": "30"
}